,url,text,title
43,https://www.hamshahrionline.ir/news/680079/%D8%B1%D8%A7%D9%86%D9%86%D8%AF%DA%AF%D8%A7%D9%86-%D8%B2%D8%B1%D9%86%DA%AF-%D9%86%D9%82%D8%B1%D9%87-%D8%AF%D8%A7%D8%BA-%D9%85%DB%8C-%D8%B4%D9%88%D9%86%D8%AF-%D9%87%D8%B4%D8%AF%D8%A7%D8%B1-%D9%BE%D9%84%DB%8C%D8%B3-%D8%AF%D8%B1%D8%A8%D8%A7%D8%B1%D9%87-%D8%B2%D8%B1%D9%86%DA%AF-%D8%A8%D8%A7%D8%B2%DB%8C,"سرهنگ علی اصغر شریفی، با اشاره به آن‌دسته از رانندگانی که با عدم رعایت حق تقدم عبور در خروجی‌ها و جناغی معابر و به خصوص بزرگراه‌ها اقدام به تضییع حقوق دیگر رانندگان و نیز اخلال در ترافیک می‌کنند، گفت: این افراد اصطلاحا تصور می‌کنند که زرنگ هستند و زرنگ بازی در می‌آورند. چنین رانندگانی به جای آن‌ که در لاین مربوط به خود برای خروج از معابر و بزرگراه‌ها حرکت کنند از لاین‌های مجاور وارد مسیر شده و علاوه بر اینکه در روند ترافیک اخلال ایجاد می‌کنند، احتمال وقوع تصادفات را نیز افزایش می‌دهند.

وی افزود:‌ در همین راستا نیز طرح پلیس در خروجی بزرگراه‌ها یا همان جناغی‌ها به اجرا درآمده و ماموران با حضور فیزیکی و نیز با استفاده از دوربین‌ها نسبت به اعمال قانون و جریمه متخلفان اقدام خواهند کرد.

رییس مرکز اطلاع‌رسانی پلیس راهنمایی و رانندگی تهران بزرگ درباره مبلغ جریمه این تخلف اظهارکرد: مبلغ این جریمه ۵۲ هزار تومان است که باید از سوی راننده پرداخت شود.

شریفی از رانندگان خواست که از انجام حرکاتی که در حین رانندگی منجر به تضییع حقوق دیگر رانندگان شده و ایمنی ترافیک را نیز به مخاطره می‌اندازد پرهیز کنند.

پیش از این سرهنگ سید ابوالفضل موسوی‌پور - جانشین رییس پلیس راهنمایی و رانندگی تهران بزرگ - از نصب دوربین‌هایی جدید برای برخورد با این تخلف خبر داده و گفته بود: در این خصوص هماهنگی‌هایی با معاونت حمل و نقل و ترافیک شهرداری تهران انجام شد و بر این اساس از چند روز آینده تعدادی دوربین در سر جناغی بزرگراه‌ها نصب می‌شود.

وی درباره اینکه این دوربین‌ها در کدام مناطق نصب خواهد شد نیز گفته بود: این موضوع را بررسی کردیم و قرار شد تا در فاز نخست این دوربین‌ها در جاهایی که هم در صبح و هم در ساعات بعدازظهر تردد بالایی دارند و حجم ترافیک در آن‌ها بالاست، نصب شوند. این مناطق شناسایی شده است و طی چند روز آینده دوربین‌ها در آن نصب خواهند شد.

جانشین رییس پلیس راهنمایی و رانندگی تهران بزرگ با بیان اینکه اقدام برخی از رانندگان در جناغی بزرگراه‌ها به طور آشکار تضییع حقوق رانندگان منضبط و قانونمند است، گفت:‌ متاسفانه برخی تصور می‌کنند که چنین رفتاری نوعی زرنگی است و بدون آنکه در لاین مربوطه تردد کنند، در نزدیکی خروجی به‌اصطلاح راه را می‌بُرند و از لاین سوم و چهارم وارد خروجی می‌شوند. این اقدام هم خلاف قانون و هم بسیار خطرناک است.",رانندگان زرنگ نقره‌داغ می‌شوند | هشدار پلیس درباره زرنگ‌بازی برخی رانندگان
44,https://www.hamshahrionline.ir/news/680073/۴-پاساژ-قائم-میری-بعثت-و-البرز-در-شمال-تهران-ناایمنند-اخطار,"به گزارش همشهری آنلاین،حمیدرضا حاجوی شهردار منطقه یک به همراه محمد حسین جعفری معاون دادستان تهران و سرپرست دادسرای ناحیه یک (الهیه) در بازدید از مجتمع های تجاری قائم، بعثت، البرز، میری و... ضمن بررسی وضعیت ایمنی، هر گونه کوتاهی در تکمیل تجهیزات ایمنی، سیستم اعلام حریق، رفع نواقص، کنترل خروجی‌ها، پله‌های اضطراری و... را مغایر حقوق شهروندی دانست و اعلام کرد: شهرداری منطقه یک با همکاری قوه قضاییه اخطارهای لازم را به مدیران مجموعه ابلاغ و ظرف مدت تعیین شده از هر گونه بهره‌برداری واحدها جلوگیری بعمل خواهد آورد.

حاجوی صیانت از جان مردم را وظیفه اصلی مدیریت شهری دانست و گفت: در اجرای احکام از هیچ اقدامی کوتاهی نخواهیم کرد و مدیریت شهری از همه ظرفیت‌های قانونی برای صیانت از ضوابط و مقررات در بحث ایمنی شهروندان استفاده خواهد کرد تا خانواده‌ها از این مراکز با خیال آسوده، حس آرامش و بدون دغدغه ایمنی استفاده کنند.",۴ پاساژ قائم، میری، بعثت و البرز در شمال تهران ناایمنند| اخطار نهایی شهرداری و دادستانی به مالکان پاساژها
45,https://www.hamshahrionline.ir/news/680074/%D8%B1%DA%A9%D9%88%D8%B1%D8%AF%D8%B4%DA%A9%D9%86%DB%8C-%D8%B3%D8%A7%D9%85%D8%B3%D9%88%D9%86%DA%AF-%D8%A7%D9%BE%D9%84-%D9%88-%D8%B4%DB%8C%D8%A7%D8%A6%D9%88%D9%85%DB%8C-%D8%AF%D9%88%D9%85-%D9%88-%D8%B3%D9%88%D9%85-%D8%B4%D8%AF%D9%86%D8%AF,"به‌ گزارش همشهری آنلاین و به‌ نقل از وب‌سایت گیزموچاینا، رکورد قبلی سامسونگ سهم ۲۵ درصدی از بازار و مربوط به سال ۲۰۱۷ بود. پس از سامسونگ، شرکت‌های اپل با ۱۵ درصد و شیائومی با ۱۲ درصد سهم بازار قرار دارند.

رشد در فروردین و اردیبهشت امسال به برند سامسونگ کمک کرد تا برای سومین ماه متوالی در بازار جهانی تلفن‌های هوشمند پیشتاز باشد. عملکرد قوی سری S22 و سری A این شرکت از جمله دلایل موفقیت سامسونگ در ماه‌های اخیر بوده است.

علی‌رغم کاهش ۸ درصدی فروش جهانی گوشی‌های هوشمند نسبت به سال قبل، غول فناوری کره جنوبی موفق شد شاهد رشد ۹ درصدی فروش سال به سال باشد.

با توجه به دستاوردهای سامسونگ در بخش گوشی‌های هوشمند تاشو، به‌نظر می‌‎رسد این شرکت همچنان بتواند پیشتازی خود در بازار را حداقل در آینده نزدیک حفظ کند.",رکوردشکنی سامسونگ | اپل و شیائومی دوم و سوم شدند
46,https://www.hamshahrionline.ir/news/680071/%D8%B9%DA%A9%D8%B3-%D8%A2%D9%86%DA%86%D9%84%D9%88%D8%AA%DB%8C-%D8%AF%D8%B1-%D8%AC%D9%85%D8%B9-%D8%A8%D8%B1%D8%AA%D8%B1%DB%8C%D9%86-%D9%85%D8%B1%D8%A8%DB%8C%D8%A7%D9%86-%D8%AA%D8%A7%D8%B1%DB%8C%D8%AE-%D9%81%D9%88%D8%AA%D8%A8%D8%A7%D9%84-%DB%B8%D9%85%D8%B1%D8%A8%DB%8C-%D9%BE%D8%B1%D8%A7%D9%81%D8%AA%D8%AE%D8%A7%D8%B1%DB%8C,"به گزارش همشهری آنلاین سرمربی ایتالیایی که حالا موفق‌ترین مربی در تاریخ لیگ قهرمانان شناخته می‌شود، در مجوع در تیم‌های میلان، چلسی، پاری‌سن‌ژرمن، بایرن مونیخ، رئال مادرید و یوونتوس ۲۳ جام فتح کرده است. او هشتمین مربی برتر تاریخ فوتبال به شمار می‌رود و بعد از الکس فرگوسن، میرکا لوچسکیو، پپ گواردیولا، والری لوبانوفسکی، ژوزه مورینیو، جاک استاین و اوتمار هیتسفیلد قرار دارد.

آنچلوتی در صورتی که فصل بعد هم در رئال بماند، شانس این را دارد که از هیتسفیلد هم عبور کند چون همچنان شانس اول قهرمانی لالیگاست و در سوپر جام اروپا هم کار نسبتا آسانی برابر آینتراخت فرانکفورت دارد. او جام جهانی باشگاه‌ها را هم خواهد داشت. لیگ قهرمانان اروپا، سوپر جام اسپانیا و جام حذفی هم دیگر جام‌های در دسترس او خواهند بود.",عکس|  آنچلوتی در جمع برترین مربیان تاریخ فوتبال | ۸مربی پرافتخاری که بیشترین جام را آوردند
47,https://www.hamshahrionline.ir/news/680075/%D8%AA%D8%B5%D9%85%DB%8C%D9%85-%D9%86%D9%87%D8%A7%DB%8C%DB%8C-%D8%A8%D8%B1%D8%A7%DB%8C-%D9%81%D8%B1%D9%88%D8%B4-%D9%85%D9%87%D8%A7%D8%AC%D9%85-%D8%A7%D8%B3%D8%AA%D9%82%D9%84%D8%A7%D9%84%DB%8C-%D8%B3%D9%87%D9%85-%DB%B3%DB%B0-%D9%85%DB%8C%D9%84%DB%8C%D8%A7%D8%B1%D8%AF%DB%8C-%D8%A2%D8%A8%DB%8C-%D9%87%D8%A7,"به گزارش همشهری آنلاین، اللهیار صیادمنش مهاجم تیم ملی فوتبال ایران در نقل و انتقالات زمستانی فصل قبل از تیم فنرباغچه ترکیه راهی تیم هال سیتی انگلیس شد.

هرچند صیادمنش در نیم فصل تنها یک گل برای هال سیتی به ثمر رساند اما عملکرد خوب او، رضایت سرمربی و مالک باشگاه انگلیسی را به دنبال داشت؛ تا جایی که مالک هال سیتی از مهاجم ایرانی تیمش به عنوان یک «جواهر» و «محمد صلاح» آینده یاد کرد.

همین موضوع باعث شده است تا هال سیتی به دنبال جذب قطعی و دائمی مهاجم تیم ملی ایران باشد و احتمالاً این کار را در نقل و انتقالات تابستانی نهایی کند.

روزنامه hurriyet ترکیه در این باره خبر داد که باشگاه فنرباغچه به دنبال درآمدزایی و به دست آوردن بودجه کافی برای نقل و انتقالات است و بزرگترین هدف آنها هم فروش اللهیار صیادمنش است.

این روزنامه جزئیات بیشتری را در این خصوص منتشر کرد و نوشت: «این مهاجم ۲۱ ساله که نیم فصل دوم به هال سیتی قرض داده شد، به زودی با این باشگاه انگلیسی قرارداد دائمی امضا خواهد کرد. فنرباغچه از انتقال اللهیار ۴ میلیون یورو دریافت خواهد کرد. ضمناً از فروش بعدی ۵۰ درصد سهم نصیب فنرباغچه می‌شود.»

صیادمنش که امروز به اردوی تیم ملی فوتبال ایران در هتل المپیک تهران اضافه شده است، در گفتگو با خبرنگاران اعلام کرد که توانسته خودش را با هال سیتی وفق بدهد و اظهار امیدواری کرد فصل خوبی در انتظارش باشد.

به این ترتیب با توجه به سهم حدودا ۲۰ درصدی استقلال رقمی نزدیک به ۸۰۰ هزار یورو (حدود ۳۰ میلیارد تومان) نصیب آبی ها از این انتقال خواهد شد.",تصمیم نهایی برای فروش مهاجم استقلالی | سهم ۳۰ میلیاردی آبی ها از انتقال پرسود!
48,https://www.hamshahrionline.ir/news/680072/%D8%A7%D8%AA%D9%81%D8%A7%D9%82-%D8%B9%D8%AC%DB%8C%D8%A8-%D8%A8%D8%B1%D8%A7%DB%8C-%D8%AC%D8%A7%D9%85-%D9%82%D9%87%D8%B1%D9%85%D8%A7%D9%86%DB%8C-%D8%A7%D8%B3%D8%AA%D9%82%D9%84%D8%A7%D9%84-%D8%AF%D8%B1-%D9%88%D8%B1%D8%B2%D8%B4%DA%AF%D8%A7%D9%87-%D8%A2%D8%B2%D8%A7%D8%AF%DB%8C-%D8%B1%D8%A7%D9%87-%D9%86%D8%AF%D8%A7%D8%AF%D9%86,"به گزارش همشهری آنلاین دیدار دو تیم استقلال تهران و نفت مسجد سلیمان در هفته پایانی لیگ برتر از ساعت ۱۹ امروز در ورزشگاه آزادی برگزار می شود. استقلال که پیش از این قهرمانی اش را در لیگ برتر قطعی کرده بود، امروز جام قهرمانی خود را دریافت می‌کند.

چند ساعت قبل از شروع مسابقه، بی‌نظمی شدیدی در مقابل درب اصلی ورزشگاه آزادی حاکم بود و ازدحام زیادی بوجود آمد. محدودیت ها و سخت گیری های ورود به ورزشگاه به اندازه ای بود که حتی عوامل سازمان لیگ که باید چندین ساعت قبل از شروع بازی در ورزشگاه حضور داشته باشند اجازه ورود نداشتند!

این موضوع باعث شد تا جام قهرمانی استقلال بیش از یک ساعت پشت درب ورزشگاه باقی بماند. بعد از عصبانیت و ناراحتی مسئولان سازمان لیگ و هماهنگی های زیاد، سرانجام اجازه ورود به آنها با جام قهرمانی استقلال داده شد.",اتفاق عجیب برای جام قهرمانی استقلال در ورزشگاه آزادی | راه ندادن جام به داخل استادیوم!
49,https://www.hamshahrionline.ir/news/680066/%D8%A7%D8%B3%D8%AA%D9%82%D8%A8%D8%A7%D9%84-%DB%B4%DB%B0%DB%B0-%D9%87%D8%B2%D8%A7%D8%B1-%D9%86%D9%81%D8%B1%DB%8C-%D8%A7%D8%B2-%D8%AC%D8%A7%D9%85-%D9%82%D9%87%D8%B1%D9%85%D8%A7%D9%86%DB%8C-%D8%B1%D8%A6%D8%A7%D9%84-%D9%85%D8%B5%D8%AF%D9%88%D9%85%DB%8C%D8%AA-%DB%B5%DB%B1-%D9%86%D9%81%D8%B1-%D8%AF%D8%B1,"به گزارش همشهری آنلاین، رئال مادرید ابتدای هفته لیورپول را در فینال لیگ قهرمانان یک بر صفر شکست داد تا به رکورد ۱۴ قهرمانی در این رقابت‌ها دست پیدا کند.

طبق سنت، تیم قهرمان بعد از فتح جام، با یک اتوبوس روباز در شهر مادرید رژه رفت تا خود را به میدان سیبلس برساند، جایی که کاپیتان تیم، شال رئال مادرید را طبق یک سنت، به دور گردن مجسمه معروف این میدان انداخت.

به نوشته ای‌اس‌پی‌ان، مقامات شهری مادرید گفته‌اند نزدیک به ۴۰۰ هزار نفر در این جشن در شب یکشنبه شرکت کرده‌اند. سازمان‌های امدادی و اورژانس مادرید هم اعلام کرده‌اند که ۵۱ نفر به خاطر سوختگی ناشی از آتش‌بازی، افتادم از بلندی و ضربه خوردن، درمان سرپایی دریافت کرده‌اند.",استقبال ۴۰۰ هزار نفری از جام قهرمانی رئال | مصدومیت ۵۱ نفر در جشن پرهیاهو
50,https://www.hamshahrionline.ir/news/680024/%D8%AF%D8%B3%D8%AA%D9%88%D8%B1-%D9%85%D9%87%D9%85-%D8%AF%D8%A7%D8%AF%D8%B3%D8%AA%D8%A7%D9%86%DB%8C-%D8%AF%D8%B1%D8%A8%D8%A7%D8%B1%D9%87-%D9%86%D9%88%D8%B2%D8%A7%D8%AF-%D8%B1%D9%87%D8%A7-%D8%B4%D8%AF%D9%87-%D8%AF%D8%B1-%D8%B3%D8%B7%D9%84-%D8%B2%D8%A8%D8%A7%D9%84%D9%87-%D9%86%D8%A7%D8%B2%DB%8C-%D8%A2%D8%A8%D8%A7%D8%AF,"به گزارش همشهری آنلاین، نجف جابری سرپرست دادسرای ناحیه ۱۶ تهران اظهار کرد: به محض دریافت گزارش مربوط به پیدا شدن یک نوزاد رهاشده در حوزه کلانتری ۱۳۰ نازی آباد و حوزه قضایی دادسرای ناحیه ۱۶، برای بررسی حال عمومی نوزاد و وضعیت نگهداری و روند درمان وی از بیمارستان بازدید کردیم.

وی ادامه داد: بر حسب اعلام پزشک مراقب در بیمارستان، همه آزمایش‌های لازم از جمله هپاتیت و ایدز از نوزاد دریافت و پاسخ منفی بود و صرفا به لحاظ رهاشدن در سطل زباله، لوب چپ ریه و پای راست نوزاد دچار عفونت و آسیب شده و مراحل درمانی ادامه دارد.

معاون دادستان تهران اضافه کرد: به مدیریت بیمارستان تاکید شد تا بر درمان نوزاد تمرکز داشته باشند و نوزاد یادشده در صورت کمبود امکانات و نیاز به درمان تخصصی به بیمارستان تخصصی و طبی اطفال منتقل شود.

جابری با اشاره به اینکه دستورهای لازم به مرجع انتظامی برای مراقبت از کودک، حفظ امنیت محل و نیز شناسایی پدر و مادر احتمالی یا فرد رهاکننده نوزاد صادر شده است، گفت: تحقیقات لازم در این زمینه در حال انجام بوده و حال عمومی نوزاد خوب گزارش شده است.",دستور مهم دادستانی درباره نوزاد رها شده در سطل زباله نازی آباد | نتیجه آزمایش ایدز و هپاتیت نوزاد اعلام شد
51,https://www.hamshahrionline.ir/news/680006/%D8%B0%D8%AE%DB%8C%D8%B1%D9%87-%DB%B5%DB%B0-%D9%85%DB%8C%D9%84%DB%8C%D9%88%D9%86-%D8%AF%D9%88%D8%B2-%D9%88%D8%A7%DA%A9%D8%B3%D9%86-%DA%A9%D8%B1%D9%88%D9%86%D8%A7-%D8%AF%D8%B1-%DA%A9%D8%B4%D9%88%D8%B1-%D9%86%DB%8C%D8%A7%D8%B2%DB%8C-%D8%A8%D9%87-%D8%B3%D8%A7%D8%AE%D8%AA-%D9%88%D8%A7%DA%A9%D8%B3%D9%86-%D9%87%D8%A7%DB%8C,"به گزارش همشهری آنلاین، دکتر مصطفی قانعی عضو کمیته ملی واکسن کرونا در توضیح جدیدترین اقدامات در حوزه واکسن‌های ایرانی کرونا گفت: واکسن ایرانی MRNA تقریبا مراحل پیش از بالین را طی کرده، اما متاسفانه هنوز نتوانسته وارد فاز بالینی شود.

قانعی گفت: در فاز پیش‌بالینی تعدادی از میمون‌هایی که این واکسن بر آنها تست شد، دچار تورم ریه شدند و قرار شد یک بار دیگر فاز پیش‌بالینی واکسن MRNA انجام شود. به محض تکمیل مستندات پیرامون این واکسن و صدور مجوزهای لازم، این واکسن هم وارد کارآزمایی بالینی خواهد شد.

وی افزود: در مورد واکسن آدنوویروسی انستیتو پاستور ایران هم هنوز فاز پیش‌بالینی طی نشده است و باید دید که فاز پیش‌بالینی به چه شکل پیش خواهد رفت.

ذخیره ۵۰ میلیون دوز واکسن کرونا در کشور

عضو کمیته ملی واکسن کرونا با اشاره به اینکه الان حدود ۵۰ میلیون دز واکسن از مجموع واکسن‌های ایرانی و خارجی ذخیره داریم و واکسن کرونا در کشور به اندازه کافی تولید و ذخیره شده است، اظهار کرد: به نظر نمی‌رسد دیگر نیازی باشد که واکسن‌سازها تولید را ادامه دهند. زیرا واکسن تاریخ انقضا دارد و بنای سازمان غذا و دارو هم اینگونه نیست که نیاز تا پایان سال به واکسن را یکباره اعلام کند.

قانعی گفت: معمولا نیاز به واکسن سه‌ماهه اعلام می‌شود و فعلا اعلام نیاز جدیدی از سوی سازمان غذا و دارو نداریم.

کاهش تقاضای جهانی برای واکسن‌های کرونا

قانعی درخصوص صادرات واکسن‌های ایرانی، ‌ تصریح کرد: باید بدانیم که در کل دنیا استقبال از واکسن کاهش یافته است؛ بنابراین؛ الان کشوری نیست که متقاضی واکسن باشد. در مورد اطلاعات صادرات واکسن‌ها باید از خود مسئولین هر شرکت واکسن ساز سوالات بیشتر را جویا شد.

وی در پاسخ به سوالی درباره واکسن‌های ایرانی که برای اخذ تاییدیه سازمان بهداشت جهانی اقدام کرده‌اند، ‌ گفت: برای همه واکسن‌های تولید شده این اقدام صورت گرفته است و با سازمان بهداشت جهانی مکاتباتی صورت گرفته است ولی فعلا هیچکدام نتوانستند تاییدیه جهانی را اخذ کنند و مراحل مربوطه در حال انجام است.

اهمیت تکمیل واکسیناسیون علیه کرونا

این مسئول با تاکید بر کاهش تقاضای جهانی واکسن کووید۱۹، ادامه داد: باید دید که وضعیت کرونا طی سه یا چهار ماه آینده به چه صورت خواهد بود که پیش‌بینی می‌کنیم وضعیت رو به بهبود خواهد بود؛ اما، شرایط جهش‌های کرونا در ابرازِ نیاز به واکسن تعیین کننده خواهد بود. آخرین جهش کرونا، امیکرون است که می‌توان به تعبیری گفت یکطرفه اعلام آتش‌بس کرده است و آنچنان خطری متوجه افراد نمی‌شود. جمعیت زیادی را درگیر می‌کند و درصدی هم مرگ و میر دارد که عمدتا در بین کسانی بوده است که واکسن نزدند یا آن را تکمیل نکرده‌اند.

دکتر قانعی گفت: نکته مهم فعلی این است که تزریق دز سوم در همه دنیا مرگ ومیر را کاهش داده است و فعلا باید تزریق سه دز تکمیل شده و برای افراد پرخطر مانند بیماران زمینه‌ای و... و. تزریق دز چهارم را انجام دهیم.

عضو کمیته ملی واکسن کرونا تاکید کرد: از زمان تزریق واکسن حداقل یک ماه زمان می‌برد تا ایمنی لازم در بدن فرد ایجاد شود. در کرونا دیدیم که بیشتر مرگ و میر در سنین بالای ۶۵ سال بوده است، پس باید افراد به دقت برای واکسیناسیون خود اقدام کنند.",ذخیره ۵۰ میلیون دوز واکسن کرونا در کشور | نیازی به ساخت واکسن‌های داخلیِ بیشتر نیست
52,https://www.hamshahrionline.ir/news/680058/%D8%A7%D9%88%D9%84%DB%8C%D9%86-%D9%88%D8%A7%DA%A9%D9%86%D8%B4-%D9%88%D8%B2%DB%8C%D8%B1-%D8%A7%D8%B1%D8%B4%D8%A7%D8%AF-%D8%A8%D9%87-%D9%81%DB%8C%D9%84%D9%85-%D8%B3%DB%8C%D9%86%D9%85%D8%A7%DB%8C%DB%8C-%D8%B9%D9%86%DA%A9%D8%A8%D9%88%D8%AA-%D9%85%D9%82%D8%AF%D8%B3,"به گزارش همشهری آنلاین، پس از برگزاری جشنواره فیلم کن ۲۰۲۲ و انتخاب بازیگر فیلم سینمایی «عنکبوت مقدس» به‌عنوان بهترین بازیگر زن این فستیوال سینمایی، واکنش‌ها نسبت به این فیلم در فضای مجازی آغاز شد و بسیاری از ایرانیان این فیلم سینمایی را توهین به مقدسات دین اسلام و امام رضا علیه السلام دانستند.

وزیر ارشاد در جدیدترین توئیت درباره این فیلم از بازنمایی‌های وارونه علیه اسلام و ایران در جشنواره‌های خارجی انتقاد کرده است.

وی در توئیتی که منتشر کرده نوشته است:

ایران‌زمین به هنرمندانی افتخار می‌کند که با عشق آل‌الله قدرشناس ایثار حافظان امنیت و سربلندی سرزمین‌مان هستند، هنرمندانی که زرق‌ و برق جشنواره‌های سیاست‌زده و تبلیغات رسانه‌های مزدور اجنبی‌پرست، آنان را در مقابل باورهای بلند ملت قهرمان قرار نمی‌دهد، سلام بر امام مهربانی.",اولین واکنش وزیر ارشاد به فیلم سینمایی عنکبوت مقدس
