,url,text,title
24,https://www.hamshahrionline.ir/news/680082/%D8%AA%D8%A7%D9%BE-%DA%AF%D8%A7%D9%86-%D9%BE%D8%B1%D9%81%D8%B1%D9%88%D8%B4-%D8%AA%D8%B1%DB%8C%D9%86-%D9%81%DB%8C%D9%84%D9%85-%D8%AF%D8%B1-%D8%B3%DB%8C%D9%86%D9%85%D8%A7%D9%87%D8%A7%DB%8C-%D8%A2%D9%85%D8%B1%DB%8C%DA%A9%D8%A7-%D8%B4%D8%AF,"به گزارش همشهری آنلاین به نقل از رویترز، تام کروز یکی از جسورانه‌ترین حرکات نمایشی حرفه هنری خود را انجام داد و مخاطبان را در دوران کرونا برای فیلمی که در آن خبری از ابرقهرمان‌ها نیست به سینماها کشاند. فیلم تاپ گان: ماوریک در سه روز اول اکران خود در آمریکای شمالی، ۱۲۴ میلیون دلار فروش کرد. پیش‌بینی می‌شود مجموع فروش این فیلم اکشن و ماجراجویانه تا پایان امروز به ۱۵۱ میلیون دلار برسد، رقمی که فراتر از انتظار بود.

تاپ گان: ماوریک پرفروش‌ترین اکران افتتاحیه را در چهل سال فعالیت هنری تام کروز برای او رقم زد. این اولین بار است که فیلمی از این ستاره هالیوودی در سه روز اول اکران بیش از ۱۰۰ میلیون دلار فروش می‌کند. این رکورد پیش‌تر در اختیار فیلم جنگ دنیاها (۲۰۰۵) بود که در اکران افتتاحیه، تنها ۶۴ میلیون دلار فروش کرد.

تماشاچیان بالای ۴۰ سال، یعنی افرادی که هنوز چراغ سبز استودیو پارامونت برای ساخت دنباله تاپ گان (۱۹۸۶) را به یاد دارند، بیشترین استقبال را از دنباله این فیلم به عمل آوردند؛ گروهی که بیش از سایرین از بازگشت به سینماها در دوران کرونا مردد بودند.

تاپ گان ۲ قرار بود تابستان سال ۲۰۲۰ اکران شود که شیوع کرونا تمام معادلات را بهم ریخت اما، همانطور که از نقدها پیداست، تاخیر دوساله در اکران فیلم نتیجه بخش بوده است. این فیلم تاکنون در وبسایت راتن تومیتوز امتیاز ۹۷ درصد و در سینمااسکور امتیاز +A را دریافت کرده است.

تاپ گان ماوریک با بودجه ۱۷۰ میلیون دلاری و به کارگردانی جوزف کوزینسکی ساخته شده و ماجراهای آن چند دهه بعد از قسمت اول اتفاق می‌افتد. در این قسمت ماوریک مامور می‌شود تا گروهی از خلبانان تازه کار نیروی دریایی را تعلیم دهد.

پس از تاپ گان ۲،‌فیلم ابرقهرمانی دکتر استرنج در چندجهانی دیوانگی پس از سه هفته صدرنشینی متوالی در گیشه، با ۱۶ میلیون دلار فروش در رتبه دوم پرفروش‌ترین فیلم‌ها قرار گرفت و فیلم برگری باب با ۱۲ میلیون دلار فروش، سوم شد.

جایگاه چهارم این فهرست نیز نصیب فیلم دانتون ابی: عصر جدید شد که با افت ۶۳ درصدی نسبت به هفته اول اکران، بین جمعه تا یکشنبه ۵ میلیون و ۹۰۰ دلار فروخت و انتظار می‌رود فروش آن تا پایان امروز به ۷ میلیون و ۵۰۰ هزار دلار برسد. فیلم سینمایی دانتون ابی: عصر جدید با گذشت دو هفته از اکران تاکنون ۶۸ میلیون و ۹۰۰ هزار دلار در گیشه جهانی فروش کرده که ۳۰ میلیون دلار آن مربوط به سینماهای آمریکا و کاناداست.

در پایان، انیمیشن بچه‌های بد از یونیورسال نیز با ۴ میلیون و ۶۰۰ هزار دلار فروش از ۲ هزار و ۹۴۴ سینما، در جایگاه پنجم از فهرست پرفروش‌ترین فیلم‌های این آخر هفته در آمریکا ایستاد.",تاپ گان پرفروش‌ترین فیلم در سینماهای آمریکا شد
25,https://www.hamshahrionline.ir/news/678988/%D9%BE%D8%A7%DB%8C%D8%A7%D9%86-%D8%AE%D9%88%D8%B4-%D9%82%D8%B5%D9%87-%D9%86%D9%88%D8%B2%D8%A7%D8%AF-%D8%B1%D9%87%D8%A7%D8%B4%D8%AF%D9%87-%DA%A9%D9%86%D8%A7%D8%B1-%D8%B3%D8%B7%D9%84-%D8%B2%D8%A8%D8%A7%D9%84%D9%87,"همشهری آنلاین - رابعه تیموری: «نیره سورانی» خبرنگار و مدرس قرآن بود و وقتی شنید «یوسف اصلانی» با همکاری خانواده و دوستانش مرکزی برای نگهداری کودکان بی‌سرپرست راه انداخته، برای مصاحبه با این جوان خاص کم‌سن و سال به این مرکز رفت. در آن جا با دیدن حس خوب آقا یوسف و معصومیت کودکانه بچه‌ها مشتاق شد به عنوان مربی قرآن در کنار ٣٠ داداش کوچولوی آقا یوسف بماند. این اشتیاق و دلبستگی خیلی زود عمیق شد و خانم مربی علاوه بر قرآن، نمایش و شعر و سرود با بچه‌ها کار می‌کرد و هر بار که آثار هنریشان در مسابقه‌ای مقامی برتر کسب می‌کرد، بچه‌ها طعم موفقیت و دیده شدن را در کنار او تجربه می‌کردند.

همکاری سورانی در این مرکز، زمینه‌ای را به وجود آورد که او و آقا یوسف احساس کنند هر دو از یک دریچه به زمین و آدم‌هایش نگاه می‌کنند و اگر به عنوان همسر در کنار هم قرار بگیرند، می‌توانند جمع خانوادگی بچه‌ها را تکمیل کنند. به جای نیره خانم آقا یوسف برای ازدواجشان شرط و شروط گذاشت: «من را باید همراه برادرانم بپذیری، زندگی من از خوشی و ناخوشی آنها جدا نیست... »

اما شرط او پیش از به زبان آوردنش هم از سوی عروس خانم پذیرفته بود. عروسی داداش یوسف و خانم سورانی که دیگر بچه‌ها زن داداش صدایش می‌زدند، در جمعی خانوادگی و همراه بچه‌های مرکز برگزار شد.

یک فرزند خاص

نه از تالار و یک ماه خرید عروسی خبری بود و نه از بریز و بپاش و مجلسی مجلل. عروس و داماد پیش از آن که به فکر خرید آینه و شمعدان عروسی باشند، بچه‌ها را نونوار کردند تا در عروسی آنها ترگل و ورگل و خوش و خندان باشند. از ازدواج آنها چندان نگذشته بود که آقا یوسف شنید در بهزیستی بندرعباس کودکی به نام «بهادر» زندگی می‌کند که در دوران نوزادی او را سر راه گذاشته‌اند و گربه و موش و حیوانات موذی لب و دهان و بینی طفل معصوم را خورده‌اند.

آقا یوسف تصمیم گرفت بهادر را به تهران بیاورد تا شاید بتواند برای درمانش کاری انجام دهد. صورت بی‌لب و بینی و دهان بهادر شرایطی نداشت که بتواند در کنار بچه‌های دیگر مرکز زندگی کند. آقا یوسف وقتی از نوعروسش خواست که از بهادر کوچک در خانه نگهداری کنند، قبول آن برای خانم سورانی آسان نبود. ولی وقتی چشم زن داداش به نگاه معصوم بهادر افتاد، تصمیم گرفت او را تا زمانی که بهبودی نسبی پیدا کند، کنار خود نگه دارد. وقتی زن داداش و بهادر با هم بیرون می‌رفتند، خانم سورانی می‌دید پسر کوچولوی او از نگاه‌های پر از تحقیر، ترحم و تعجب مردم چقدر رنج می‌برد و سعی می‌کرد با مهربانی‌های مادرانه اش تحمل این رنج را برای او آسان‌تر کند.

دلنگرانی‌های مادرانه

زن داداش به جای مادری که هیچ وقت در کنار بهادر نبوده، لحظه‌های پر از اضطراب پشت در اتاق عمل جراحی را تجربه کرد و هر روز به امید نشانه‌ای از بازگشت سلامتی بهادر به صورت آزرده او چشم دوخت. یک روز که بهادر همراه زن داداش به پارک رفته بود، با دیدن بچه‌هایی که کنار مادرانشان شاد و خوشحال مشغول خوردن بستنی بودند، از زن داداش خواست برایش بستنی بخرد تا در پناه چادر او و دور از نگاه‌های آزاردهنده دیگران این لذت را تجربه کند.

آن روز این حسرت و آرزوی کوچک بهادر، آنقدر طعم تلخی در وجود زن داداش نشاند که چند سال بعد او و آقا یوسف تصمیم گرفتند تعدادی از کودکان یتیم معلول را در جمع داداش کوچولوهای آقا یوسف بپذیرند. بهادر هنوز سلامتیش را کامل به دست نیاورده، ولی بعد از چند عمل جراحی سخت و سنگین حالا می‌تواند با لب و دهان مصنوعی خود کمی شبیه همسالانش حرف بزند، بخندد و بدون سنگینی نگاه‌های نامهربان، در پارک و کوچه و خیابان یک دل سیر خوراکی بخورد.

بهادر و ٣١ داداش معلول آقا یوسف در یکی از ٤ شعبه «بهشت امام رضا (ع) » زندگی می‌کنند. این بهشت زمینی را که داداش یوسف بنا کرده، خانه و سرپناه ١۵٠ کودک و نوجوان بی‌سرپرست و ١۵٠ پدربزرگ و مادربزرگ بیمار و رها شده است.

در روزهایی که بهادر میهمان خانه داداش یوسف بود، فرزندشان «مقداد» هم به دنیا آمد. مقداد حالا نوجوان شده، ولی از وقتی چشم باز کرده، پدر و مادر را دلنگران عموهای یتیم و پدربزرگ و مادربزرگ‌های دلشکسته اش دیده است.",پایان خوش قصه نوزاد رهاشده کنار سطل زباله
26,https://www.hamshahrionline.ir/news/680078/%D9%88%D8%A7%DA%A9%D9%86%D8%B4-%D8%A7%D9%84%D9%87%D8%A7%D9%85-%D8%B9%D9%84%DB%8C-%D8%A7%D9%81-%D8%A8%D9%87-%D8%AD%D8%A7%D8%AF%D8%AB%D9%87-%D8%AA%D9%84%D8%AE-%D9%85%D8%AA%D8%B1%D9%88%D9%BE%D9%84-%D8%AF%D8%B1-%D9%BE%DB%8C%D8%A7%D9%85-%D8%A8%D9%87-%D8%B1%D8%A6%DB%8C%D8%B3%DB%8C,"به گزارش همشهری‌آنلاین، الهام علی اف در پیامی خطاب به آیت‌الله سید ابراهیم رئیسی رئیس جمهور، حادثه آبادان و جانباختن و زخمی شدن تعدادی از شهروندان ایرانی را به دولت و ملت ایران تسلیت گفت.

رئیس جمهور جمهوری آذربایجان در ادامه این پیام با خانواده‌های داغدار ابراز همدردی و برای مجروحان شفای عاجل آرزو کرد.

احسان عباسپور معاون استاندار خوزستان و فرماندار ویژه آبادان گفت: تاکنون پیکرهای ‌۳۱ نفر از جانباختگان حادثه متروپل از زیر آوار بیرون کشیده شده است.

بخشی از برج ۱۱ طبقه متروپل آبادان ساعت ۱۲ و ۴۰ دقیقه روز دوشنبه دوم خردادماه ریزش کرد.

با گذشت هشت روز از وقوع این حادثه عملیات آواربرداری با بسیج امکانات و تجهیزات و نیز حضور شبانه روزی نیروهای امدادی ادامه دارد.",واکنش الهام علی اف به حادثه تلخ متروپل در پیام به رئیسی
27,https://www.hamshahrionline.ir/news/680070/%D8%AE%D8%A7%D9%88%D8%B1%DB%8C-%D9%88-%DB%B3-%D9%81%D8%B1%D8%B2%D9%86%D8%AF%D8%B4-%D9%BE%D8%B3-%D8%A7%D8%B2-%D8%A7%D8%AE%D8%AA%D9%84%D8%A7%D8%B3-%D9%88-%D9%81%D8%B1%D8%A7%D8%B1-%D8%A7%D8%B2-%D8%A7%DB%8C%D8%B1%D8%A7%D9%86-%DA%86%D9%87-%D9%85%DB%8C-%DA%A9%D9%86%D9%86%D8%AF-%D8%A7%D8%B2,"به گزارش همشهری‌آنلاین، روزنامه «صبح نو» نوشت: نام محمودرضا خاوری، مدیرعامل پیشین بانک ملی با اختلاس سه‌هزار میلیاردی که در سال۱۳۹۰ برملا شد، عجین شده است؛ فسادی که خاوری را بر آن داشت با اسم ماموریت کاری به انگلستان بگریزد و از آنجا به کانادا برود. اما آنچه باعث شد تا نام خاوری دوباره سر زبان‌ها بیفتد، گزارش مجله «تایکون» درباره فعالیت‌های اقتصادی یکی از فرزندان او به نام اردوان است که از او با عنوان «تاجر الهام‌بخش» قدردانی کرده است. خاوری پدر که بود و پس از فرار از ایران، او و فرزندانش مشغول چه فعالیت‌هایی شدند؟

وقتی نام خاوری به میان می‌آید، فساد کلان بانکی افشاشده در ابتدای دهه۹۰ شمسی و کشور کانادا به ذهن متبادر می‌شود. یک دهه است که خاوری و کانادا به استعاره‌هایی از فعالیت‌های مشکوک اقتصادی تبدیل شده‌اند. طی این یک دهه، هرازچندگاهی تصاویری از خاوری و خانواده او به بیرون درز می‌کند و اخبار و گمانه‌ها درباره وضعیت او شایع می‌شود. نام خاوری و خانواده او چند روزی است که دوباره مطرح شده است. بهانه این مطرح شدن، گزارش مجله‌ای تحت عنوان «تایکون» درباره اردوان خاوری فرزند محمودرضاست. مجله تایکون در یکی از شماره‌های اخیر خود اردوان (اردی) خاوری، پسر محمودرضا خاوری، مدیرعامل پیشین بانک ملی ایران و از مجرمان محکوم‌شده در ایران به‌خاطر مشارکت در اختلاس سه‌هزار میلیارد تومانی را به‌عنوان «تاجر الهام‌بخش» سال۲۰۲۲ انتخاب کرده است.

نکته جالب گزارش تایکون این است که این مجله خانواده اردوان را کارآفرین عنوان کرده است. در گزارش مجله تایکون درباره اردوان خاوری آمده است: «اردوان خاوری متعلق به خانواده‌ای است که چندین نسل سابقه کارآفرینی دارند و تجربه صدها سال کسب‌وکار و ظرافت‌های آن به او ارث رسیده است». گزارش مجله تایکون درباره دیگر فعالیت‌های دیگر اقتصادی اردوان خاوری نوشته است: «ارتباط دایمی اردوان خاوری با صاحبان کسب‌وکارهای اماراتی باعث شد تا او در سال۲۰۰۷ یک شرکت بازرگانی تخصصی در زمینه خریدوفروش مصالح ساختمانی در این کشور راه‌اندازی کند». خاوری پدر اما که بود و چگونه از ایران فرار کرد؟

فرار به اسم ماموریت

قاضی سراج، قاضی پرونده فساد کلان بانکی، در ابتدای سیزدهمین جلسه دادگاه این فساد(خردادماه ۱۳۹۱) درباره نحوه خروج خاوری از کشور و فرار به کانادا گفت: «در جلسه قبلی متهم ردیف اول مطالبی را عنوان کرد مبنی بر اینکه دست‌هایی در کار بوده تا خاوری را از کشور فراری دهند. در تاریخ ۲۰/۶/۹۰ آقای خاوری -مدیرعامل وقت بانک ملی- به‌عنوان ماموریت، تقاضای خروج از کشور به انگلستان را داشته است. در تاریخ ۲۹/۶/۹۰ طی نامه‌ای با ماموریت ایشان(اشاره سراج به شرکت در جلسه بانک پی‌ال‌سی لندن) به خارج از کشور موافقت شده است». سراج تاکید کرد: «در ۶/۷/۹۰ مشاور نهاد [ریاست‌جمهوری] و دبیر هیات نظارت بر مسافرت‌های خارجی کارکنان دولت آن ماموریت را کان لم‌یکن تلقی کرده است؛ یعنی چند روز بعد از اینکه خاوری به خارج رفته است این ماموریت کان‌لم‌یکن تلقی می‌شود و آقای خاوری در هتلی در انگلستان و از طریق فکس استعفای خود را به دفترش اعلام می‌کند». در تمام سال‌هایی که خاوری به کانادا گریخته، گزارش‌های زیادی درباره فعالیت‌های اقتصادی او و فرزندانش منتشر شده است.

خشِ بابا!

خاوری سه فرزند به نام‌های خشایار، پرندیس و اردوان دارد. خشایار خاوری به‌علت سختی تلفظ خشایار در زبان انگلیسی، در وب‌سایتش نام «خش» را برای خود برگزیده است. خشایار، هم کارشناسی و هم کارشناسی‌ارشدش را در دانشگاه تورنتو خوانده است و اکنون برای خودش بروبیای اقتصادی دارد. ازجمله فعالیت‌های تجاری خش می‌توان به فعالیتش در بخش املاک و مستغلات در دو پروژه مشارکتی با ارزش مالی بین ۵۰میلیون دلار تا یک‌بیلیون دلار اشاره کرد. بنگاه هتلداری خش شامل سه رستوران لوکس، یک شرکت پذیرایی، دو پروژه جدید در خط‌لوله و یک شرکت مدیریت خدمات است. سه رستوران خش خاوری به نام‌های «کاوا»، «چابرول» و «اطلس» با استقبال زیاد مشتریان کانادایی مواجه شده است.

شرکت‌های اقماری اردی

اردوان خاوری برخلاف برادرش خشایار، به‌جای کانادا بیشتر در حوزه دوبی مشغول به فعالیت بوده است. اردوان که مجله «تایکون» چندی پیش او را «تاجر الهام‌بخش» لقب داد، فعالیت‌های تجاری خود را در سال۲۰۰۵ با تاسیس یک آژانس هواپیمایی آغاز کرد. دو سال بعد یعنی در سال۲۰۰۷، اردی یک شرکت تجاری در زمینه دادوستد مصالح ساختمانی تاسیس کرد. اردوان چهار سال بعد در سال۲۰۱۱، شرکتی برای ساخت‌وساز منازل لاکچری به راه انداخت. سه سال بعد، اردوان یک رستوران بزرگ در ایالت یورکویل آمریکا تاسیس کرد. اردوان در سال‌های بعد نیز شرکت‌های دیگری در زمینه سرمایه‌گذاری به وجود آورد.

دختر بابا

پرندیس خاوری برخلاف برادرهایش پی درس‌ و مشق و علم‌آموزی بود اما گویا پدر با بخشش خانه به دختر، جبران مافات کرده است. خانه خاوری در تورنتو که از قضا بسیار خبرساز هم شد، نه متعلق به او که چندی پس از حضور خاوری در کانادا به نام دخترش شد.

باج‌خواهی میلیون دلاری از تاجر ایرانی-کانادایی

علاوه بر موارد مذکور، نام اردوان به همراه برادرش، خشایار و پدرش، محمودرضا چند سال پیش در یک پروژه مشترک ساخت‌وساز با یک تاجر ایرانی بر سر زبان‌ها افتاد و به تشکیل یک دادگاه منتج شد. ماجرای شراکت نافرجام خانواده خاوری با سام میرزاهی، از سرمایه‌گذاران ایرانی - کانادایی، هرچند بازتاب چندانی در رسانه‌های داخلی ایران نداشت اما در کانادا غوغا کرد. به گزارش بلومبرگ، میرزاهی، خاوری را در سال‌۲۰۰۸ ملاقات کرد. دو پسر خاوری، خشایار و اردوان، از ابتدای دهه سوم زندگی‌شان وارد کار مشترک با میرزاهی شدند. پایگاه خبری «گلاب‌اندمیل» سال‌۱۳۹۵ گزارشی در همین زمینه منتشر کرد. در آوریل سال‌۲۰۱۴، میرزاهی درباره مشکلات مالی اردوان (پسر محمود خاوری) در دوبی سخنانی را منتقل کرد. طبق اسناد دادگاه، میرزاهی در صورت پرداخت‌ نکردن ۱۴میلیون دلار از فروش پروژه «هزلتون» با تهدید فیزیکی روبه‌رو خواهد بود. میرزاهی در آن زمان گفت هیچ پولی از پروژه‌ها تا اتمام کامل‌شان توزیع نشد. میرزاهی همان زمان گفت خاوری تهدیدش کرد اگر همکاری نکند، شهرتش را خراب می‌کند. خاوری یک ساعت برای تهیه صورت‌حساب به او فرصت داد و گفت در غیر این صورت، عواقب همکاری‌ نکردن را بپذیرد. میرزاهی ادعا کرده از ترس تهدیدها، هفت میلیون دلار چک به خانواده خاوری داده است.

درخواست ایرانیان مقیم کانادا برای لغو تابعیت خاوری

همچنین گروهی از فعالان دانشگاهی، سیاسی و اجتماعی ایرانی مقیم کانادا در نامه به جیسن کنی، وزیر وقت مهاجرت و شهروندی این کشور به حضور خاوری در خاک کانادا معترض شدند. در بخشی از نامه ایرانیان مقیم کانادا با بیش از هزارو ۵۰۰ امضا آمد که «وزیر امور مهاجرت و شهروندی می‌تواند از قدرت خود استفاده کند و در صورت اثبات اینکه فردی به دروغ خود را معرفی کرده یا تقلب و خلافی کرده باشد، امتیاز شهروندی یا ویزای اقامت دائم را از او پس بگیرد».",خاوری و ۳ فرزندش پس از اختلاس و فرار از ایران چه می‌کنند؟ | از ثروت «خَش خاوری» تا سرنوشت «پرندیس خاوری» | اردی هم الهام بخش شد!
