,url,text,title
32,https://www.hamshahrionline.ir/news/679997/درخواست-فوری-فرانسه-از-ایران-درباره-دو-نفتکش-توقیف-شده-یونانی,"به گزارش همشهری‌آنلاین، سخنگوی وزارت امور خارجه فرانسه در بیانیه‌ای از مقام‌های جمهوری اسلامی ایران درخواست کرد تا دو نفتکش‌ یونانی توقیف شده در آب‌های خلیج فارس را آزاد کنند.

وبگاه «عرب نیوز» در این خصوص گزارش کرد، نیروی دریایی سپاه روز جمعه (۶ خرداد ماه)، دو فروند نفتکش یونانی را به دلیل تخلفات انجام گرفته در آب‌های خلیج فارس توقیف کرد.

سخنگوی وزارت امور خارجه فرانسه در بیانیه‌ای از مقام‌های ایران درخواست کرد که این نفتکش‌ها را آزاد کند و گفت: «ما از ایران درخواست می‌کنیم که فوراً خدمه و کشتی‌ها را آزاد کنند».

در ادامه این بیانیه‌ آمده است: «فرانسه تعهد خود را به قواعد حقوق بین‌الملل در حمایت از آزادی دریانوردی و ایمنی دریایی تکرار می‌کند. ما از ایران می‌خواهیم فورا اقدامات خود را که مغایر با این قوانین است، متوقف کند».

مقام‌های جمهوری اسلامی ایران روز شنبه اعلام کردند که خدمه دو نفتکش یونانی در سلامت کامل قرار دارند و تحت بازداشت نیستند.

پیش از این روابط عمومی کل سپاه پاسداران انقلاب اسلامی در اطلاعیه‌ای در خصوص توقیف نفتکش‌های یونانی اعلام کرد: «نیروی دریایی سپاه روز جمعه دو فروند نفتکش یونانی را به دلیل تخلفات انجام گرفته در آب‌های خلیج فارس توقیف کرد. این دو کشتی، یکی در نزدیکی عسلویه و دیگری در نزدیکی بندرلنگه در نزدیکی جزیره هندورابی توقیف شده‌اند. هر دو کشتی با نام‌هایPrudent Warrior و Delta Poseidon و تحت پرچم یونان حرکت می‌کرده‌اند و نیروی دریایی سپاه پاسداران انقلاب اسلامی آنها را توقیف کرد».

علی‌رغم آن‌که نفتکش‌های یونان به دلیل تخلفات انجام داده، توقیف شده‌اند، یونان توقیف این دو کشتی را «معادل دزدی دریایی» دانسته و محکوم کرده و به شهروندان خود هشدار داده است که به ایران سفر نکنند.

یونان مدعی است که یکی از نفتکش‌ها در آب‌های بین‌المللی حرکت می‌کرده است و نفتکش‌ دوم در هنگام توقیف در نزدیکی ساحل ایران بوده است.

وزارت خارجه یونان اعلام کرده است که 9 شهروند یونانی در بین خدمه نفتکش‌ها بوده است اما توضیح بیشتری در خصوص دیگر ملوان‌هایی که سوار بر نفتکش‌ها بودند، ارائه نکرده است.

پیش از این نیز «پیتر استانو» سخنگوی اتحادیه اروپا روز یکشنبه در بیانیه‌ای به توقیف دو نفتکش یونانی در آب‌های خلیج فارس توسط ایران واکنش نشان داد و گفت: «ما با نگرانی زیاد توقیف غیرقابل قبول دو کشتی یونانی توسط ایران در خلیج فارس را پیگیری می‌کنیم».

استانو در این بیانیه افزود: «ما بلافاصله نگرانی شدید خود را با مقام‌های ایرانی در مورد این اقدامات ابراز کرده و خواستار شفاف سازی، حل و فصل و کاهش سریع تنش شدیم».

این مقام اتحادیه اروپا بدون اشاره به اقدام خصمانه چند ماه پیش یونان در توقیف نفتکش ایرانی و تحویل آن به آمریکا گفت: «آزادی دریانوردی و جریان آزاد تجارت، اصل اساسی اتحادیه اروپا است».

روز چهارشنبه چهارم خرداد ماه سال‌جاری وزارت امور خارجه جمهوری اسلامی ایران از احضار کاردار یونان (در غیاب سفیر این کشور) به این وزارتخانه در پی توقیف محموله نفتکش تحت پرچم جمهوری اسلامی ایران در آب‌های یونان و اعتراض شدید به وی خبر داد.

روز جمعه نیز کاردار سوئیس (در غیاب سفیر این کشور) به عنوان حافظ منافع آمریکا به وزارت امور خارجه جمهوری اسلامی ایران احضار شد. از سوی دیگر جمعه شب ششم خرداد ماه نیز اخباری منتشر شد از این‌که ایران اقدام به توقیف دو کشتی یونانی در پاسخ به اقدام دولت یونان کرده است.",درخواست فوری فرانسه از ایران درباره دو نفتکش توقیف شده یونانی
33,https://www.hamshahrionline.ir/news/679997/%D8%AF%D8%B1%D8%AE%D9%88%D8%A7%D8%B3%D8%AA-%D9%81%D9%88%D8%B1%DB%8C-%D9%81%D8%B1%D8%A7%D9%86%D8%B3%D9%87-%D8%A7%D8%B2-%D8%A7%DB%8C%D8%B1%D8%A7%D9%86-%D8%AF%D8%B1%D8%A8%D8%A7%D8%B1%D9%87-%D8%AF%D9%88-%D9%86%D9%81%D8%AA%DA%A9%D8%B4-%D8%AA%D9%88%D9%82%DB%8C%D9%81-%D8%B4%D8%AF%D9%87-%DB%8C%D9%88%D9%86%D8%A7%D9%86%DB%8C,"به گزارش همشهری‌آنلاین، سخنگوی وزارت امور خارجه فرانسه در بیانیه‌ای از مقام‌های جمهوری اسلامی ایران درخواست کرد تا دو نفتکش‌ یونانی توقیف شده در آب‌های خلیج فارس را آزاد کنند.

وبگاه «عرب نیوز» در این خصوص گزارش کرد، نیروی دریایی سپاه روز جمعه (۶ خرداد ماه)، دو فروند نفتکش یونانی را به دلیل تخلفات انجام گرفته در آب‌های خلیج فارس توقیف کرد.

سخنگوی وزارت امور خارجه فرانسه در بیانیه‌ای از مقام‌های ایران درخواست کرد که این نفتکش‌ها را آزاد کند و گفت: «ما از ایران درخواست می‌کنیم که فوراً خدمه و کشتی‌ها را آزاد کنند».

در ادامه این بیانیه‌ آمده است: «فرانسه تعهد خود را به قواعد حقوق بین‌الملل در حمایت از آزادی دریانوردی و ایمنی دریایی تکرار می‌کند. ما از ایران می‌خواهیم فورا اقدامات خود را که مغایر با این قوانین است، متوقف کند».

مقام‌های جمهوری اسلامی ایران روز شنبه اعلام کردند که خدمه دو نفتکش یونانی در سلامت کامل قرار دارند و تحت بازداشت نیستند.

پیش از این روابط عمومی کل سپاه پاسداران انقلاب اسلامی در اطلاعیه‌ای در خصوص توقیف نفتکش‌های یونانی اعلام کرد: «نیروی دریایی سپاه روز جمعه دو فروند نفتکش یونانی را به دلیل تخلفات انجام گرفته در آب‌های خلیج فارس توقیف کرد. این دو کشتی، یکی در نزدیکی عسلویه و دیگری در نزدیکی بندرلنگه در نزدیکی جزیره هندورابی توقیف شده‌اند. هر دو کشتی با نام‌هایPrudent Warrior و Delta Poseidon و تحت پرچم یونان حرکت می‌کرده‌اند و نیروی دریایی سپاه پاسداران انقلاب اسلامی آنها را توقیف کرد».

علی‌رغم آن‌که نفتکش‌های یونان به دلیل تخلفات انجام داده، توقیف شده‌اند، یونان توقیف این دو کشتی را «معادل دزدی دریایی» دانسته و محکوم کرده و به شهروندان خود هشدار داده است که به ایران سفر نکنند.

یونان مدعی است که یکی از نفتکش‌ها در آب‌های بین‌المللی حرکت می‌کرده است و نفتکش‌ دوم در هنگام توقیف در نزدیکی ساحل ایران بوده است.

وزارت خارجه یونان اعلام کرده است که 9 شهروند یونانی در بین خدمه نفتکش‌ها بوده است اما توضیح بیشتری در خصوص دیگر ملوان‌هایی که سوار بر نفتکش‌ها بودند، ارائه نکرده است.

پیش از این نیز «پیتر استانو» سخنگوی اتحادیه اروپا روز یکشنبه در بیانیه‌ای به توقیف دو نفتکش یونانی در آب‌های خلیج فارس توسط ایران واکنش نشان داد و گفت: «ما با نگرانی زیاد توقیف غیرقابل قبول دو کشتی یونانی توسط ایران در خلیج فارس را پیگیری می‌کنیم».

استانو در این بیانیه افزود: «ما بلافاصله نگرانی شدید خود را با مقام‌های ایرانی در مورد این اقدامات ابراز کرده و خواستار شفاف سازی، حل و فصل و کاهش سریع تنش شدیم».

این مقام اتحادیه اروپا بدون اشاره به اقدام خصمانه چند ماه پیش یونان در توقیف نفتکش ایرانی و تحویل آن به آمریکا گفت: «آزادی دریانوردی و جریان آزاد تجارت، اصل اساسی اتحادیه اروپا است».

روز چهارشنبه چهارم خرداد ماه سال‌جاری وزارت امور خارجه جمهوری اسلامی ایران از احضار کاردار یونان (در غیاب سفیر این کشور) به این وزارتخانه در پی توقیف محموله نفتکش تحت پرچم جمهوری اسلامی ایران در آب‌های یونان و اعتراض شدید به وی خبر داد.

روز جمعه نیز کاردار سوئیس (در غیاب سفیر این کشور) به عنوان حافظ منافع آمریکا به وزارت امور خارجه جمهوری اسلامی ایران احضار شد. از سوی دیگر جمعه شب ششم خرداد ماه نیز اخباری منتشر شد از این‌که ایران اقدام به توقیف دو کشتی یونانی در پاسخ به اقدام دولت یونان کرده است.",درخواست فوری فرانسه از ایران درباره دو نفتکش توقیف شده یونانی
34,https://www.hamshahrionline.ir/news/680059/%D8%AD%D8%AF%D9%88%D8%AF-%DB%B1%DB%B5%DB%B0-%D9%87%D8%B2%D8%A7%D8%B1-%D8%B2%D8%A7%D8%A6%D8%B1-%D8%A8%D9%87-%D8%AD%D8%B1%D9%85-%D8%A7%D9%85%D8%A7%D9%85-%D8%B1%D9%87-%D9%85%D8%B4%D8%B1%D9%81-%D9%85%DB%8C-%D8%B4%D9%88%D9%86%D8%AF,"به گزارش همشهری‌آنلاین، محمدعلی انصاری روز دوشنبه در نشست خبری سی و سومین سالگرد ارتحال حضرت امام خمینی (ره)، گفت: در تاریخ معاصر یا قرن بیستم و حتی قبل از آن نمی‌توان یک شخصیت و یک رهبر و زمامدار جامعه‌ای را مثل امام پیدا کرد که برای مردم احترام و اهمیت قائل شود و همه زوایای زندگی او با مسأله خدمت به جامعه اسلامی و ملت ایران عجین شده باشد.

وی با اشاره به سخنان حضرت امام درباره جایگاه مردم گفت: امام مردم را در رأس امور می‌دانستند و وقتی می‌فرماید مجلس در رأس امور است و مردم در تعیین نمایندگان آن نقش دارند، به تعبیری می‌خواهد بفرماید مردم در رأس امور هستند. یا وقتی فرمودند میزان رأی ملت است و یا حتی فراتر از آن در دیداری که خبرگان و اعضای شورای نگهبان داشتند وقتی صحبت از جایگاه رأی مردم می‌شود، امام صراحتا می‌فرماید اگر مردم خلاف منافع خودشان رأی دادند کسی نباید خلاف آن عمل کند.

دبیر ستاد مرکزی بزرگداشت امام خمینی(ره)وی یادآور شد: اعتقاد امام به مردم و تعیین رأی مردم در سرنوشت جامعه یک اعتقاد منبعث از تفسیر اسلام ناب بود و از این رو امام با فهم جامع، فقاهت عمیق و اشرافی که بر مسائل سیاسی و فرهنگی در جامعه اسلامی داشتند برای مردم نقش حاکمیت بخش قائل بودند و در حقیقت سخن آخر می‌دانستند.

وی تأکید کرد: در حقیقت امام و رهبر معظم انقلاب معتقدند مردم رکن هستند و امام سه اصل داشتند که آن سه اصل خداباوری، مردم باوری و خودباوری بود و این تصویر امام از جامعه اسلامی بوده است از این رو رهبر انقلاب هم که خلف شایسته ایشان هستند نیز همین مشی، مرام، اعتقاد و باور را دارند.

حدود ۱۵۰ هزار زائر به حرم امام مشرف می‌شوند

انصاری تصریح کرد: امسال با توجه به فروکش کردن کرونا قرار شد مراسم بزرگداشت را با شرط رعایت موارد بهداشتی برگزار شود. البته امسال مانند سال های گذشته ثبت نام میلیونی نخواهیم داشت و بنا شده تا سقف ۱۵۰ هزار نفر از ۱۰ استان همجوار تهران به مرقد امام راحل مشرف شوند.

وی با بیان اینکه سخنرانی رهبر معظم انقلاب در روز ۱۴ خردادماه از صدا و سیما پخش خواهد شد، گفت: همچنین شب ۱۴ خرداد رییس جمهور از ساعت ۲۱ در حرم امام سخنرانی دارند و مراسم روز ارتحال از ساعت ۹ آغاز خواهد شد.

دبیر ستاد مرکزی بزرگداشت امام خمینی(ره) در خصوص برنامه ریزی های فرهنگی سی و سومین سالگرد بزرگداشت امام خمینی گفت: برگزاری دومین جشنواره «مهربانترین پدر نویسندگان فردا»، تولیدات چند رسانه ای، مستند رحلت حضرت امام، چند سرود و نماهنگ با عناوین «پیر مراد» و «فرزندان روح الله» و همچنین چاپ و انتشار هفت عنوان از آثار مرتبط با امام و پنج نشریه و چاپ پوسترها و بنرها و تولید و عرضه نمایشگاه سیر زندگی حضرت امام و چند همایش از جمله «دانشگاه و دانشگاهیان در اندیشه حضرت امام» و رونمایی از چند نرم افزار در ارتباط با زندگی امام از جمله این برنامه‌هاست.

وی خصوص برنامه های انتظامی و امنیتی نیز گفت: الحمدلله کشور ما به رغم کینه توزی ها و دشمنی های که علیه ملت است از کشورهای امن در دنیا است. شخصیت های عالی رتبه نظام، جمعیت قابل ملاحظه‌ای از شخصیت های جهان اسلام در مراسم حضور دارند. برای آسایش مردم هم با شرکت مترو، تاکسیرانی، شرکت واحد، وزارت راه و پایانه ها هماهنگی انجام شده است.

برای نشر اندیشه‌های امام کم کاری شده است

انصاری درباره میزان ترویج اندیشه امام در کشور گفت: در حوزه ترویج اندیشه‌های امام کم کاری زیادی داشته‌ایم. البته این هم ناشی از دو قضیه است، یکی بعد عظمت امام که هر مقدار هم تلاش کنیم کافی نیست و دوم اینکه تصور می‌شود برای امام خیلی کار شده است.

انصاری تأکید کرد: در مدارس، دانشگاه‌ها، کتاب‌های درسی، حوزه‌های علمیه و مجامع تحلیلی و سیاسی کم کاری زیاد شده است و اعتراف می کنیم هنوز نتوانسته ایم حق امام و رسالت وی در این مورد را ادا کنیم. ان شاء الله یک جهاد تبین در حوزه ترویج اندیشه امام شکل بگیرد تا بتوانیم پاسخگوی نیازهای نسل امروز باشیم.

وی همچنین در پاسخ به سؤالی در خصوص مهمانان خارجی گفت: امسال به دلیل مشکلات کرونا در کشورهای مبدأ، از شخصیت های خارجی دعوت نشده است. اما برخی شخصیت ها وارد کشور شده و می‌شوند و وزارت خارجه و دستگاه‌های دیگر برنامه های مفصلی در این باره دارند.

دبیر ستاد مرکزی بزرگداشت امام خمینی(ره) در خصوص هدایت ترافیک داخل شهر تهران نیز خاطرنشان کرد: فردا محدودیت‌های ترافیکی اعلام خواهد شد. اما به دلیل کاهش جمعیت نسبت به سال های گذشته و عدم تردد در تهران، امسال ترافیک سبک تری خواهیم داشت.",حدود ۱۵۰ هزار زائر به حرم امام (ره) مشرف می‌شوند
35,https://www.hamshahrionline.ir/news/680048/%D8%AC%D8%B2%D8%A6%DB%8C%D8%A7%D8%AA-%D9%BE%D8%B3-%DA%AF%D8%B1%D9%81%D8%AA%D9%86-%D8%A7%D9%85%D8%B6%D8%A7%DB%8C-%D8%B3%DB%8C%D9%86%D9%85%D8%A7%DA%AF%D8%B1%D8%A7%D9%86-%D8%A7%D8%B2-%DB%8C%DA%A9-%D8%A8%DB%8C%D8%A7%D9%86%DB%8C%D9%87-%D8%B3%DB%8C%D8%A7%D8%B3%DB%8C-%D8%AA%DB%8C%D8%B1-%D8%AE%D8%A7%D8%B1%D8%AC-%D9%86%D8%B4%DB%8C%D9%86%D8%A7%D9%86,"به گزارش همشهری آنلاین، در این بیانیه که به بهانه هم‌دردی با مردم داغ‌دار آبادان نگارش یافته است، از نیروی نظامی کشور خواسته شده تا سلاح‌های خود را زمین گذاشته و به مردم ملحق شوند. در این بیانیه که آشکارا، مشخص است با منویات سیاسی نگارش یافته، اصل حاکمیت و مبانی صریح در آن زیر سوال رفته است.

مولفان این بیانیه حتی در این چند خط محدود نیز نتوانسته‌اند خشم فروخورده خود را پنهان کرده و تناقض‌گویی خود را آشکار نکنند. میزان این تناقض به اندازه‌ای است که هدف بیانیه را هم‌دردی با مردم آبادان لحاظ کرده اما در ادامه، از عباراتی چون فساد، ناکارآمدی، دزدی، سرکوب و خفقان استفاده کرده و سمت و سوی یک حرکت اجتماعی رایج در زمینه رافت انسانی را به یک بیانیه با اغراض و اهداف سیاسی متمایل کرده است.

از شب گذشته که این بیانیه با امضای حدود ۵۰ سینماگر در برخی شبکه‌های اجتماعی، به‌شکلی محدود منتشر شده است، بسیاری از امضاءکنندگان از روش‌های مختلفی چون صفحات مجازی خود و مصاحبه با خبرگزاری‌ها، ضمن پس گرفتن امضای خود، به موارد دیگری نیز اشاره کرده‌اند که می‌توان به اضافه کردن بندهای سیاسی به این بیانیه پس از امضای آنها و البته ملتفت نبودن از بندهای این بیانیه اشاره کرد.

برخی نیز اعلام کرده‌اند که به آنها گفته شده بیانیه‌ای در راستای هم‌دردی با حادثه‌دیدگان آبادان تهیه شده و آیا مایل هستید آن را امضا کنید که آنها نیز غافل از محتویات این بیانیه، می‌گویند که نام‌شان را نیز به عنوان امضاکننده، پای این بیانیه بیاورند.

برخی نیز اعلام کرده‌اند که این بیانیه، هیچ هدف و غرض سیاسی را در نظر نداشته و صرفا به این معنی است که نیروی نظامی، آگاهی و خونسردی خود را در قبال عده‌ای خراب‌کار حفظ کرده و ناخواسته وارد زمین بازی دشمن نشود.

حسن برزیده که یکی از امضاکنندگان این بیانیه است، به ایرنا می‌گوید: این بیانیه، متن کوتاه و روشنی دارد و طبیعی است که هر سینماگری همچون من، از هر بیانیه‌ای که طی آن تشویق به خشونت نشود، حمایت می‌کند. البته که اصلا، نظام خود را مصداق این بیانیه نمی‌داند و قطعا مبرا از این اتفاق است.

این بیانیه، دومین بیانیه‌ای است که طی هفته‌های اخیر با محوریت سینماگران، از خارج هدایت می‌شود. برخی سینماگران به ایرنا گفته‌اند که از ماهیت تشکیل‌دهندگان گروه مجازی برای امضای این بیانیه بی‌خبر هستند و تنها یک گروه در واتس‌آپ تشکیل شده و از سینماگران خواسته شده که در جهت موافقت با این بیانیه، اعلام آمادگی کنند.

این اتفاق و جریان، مصادف است با جنبش می‌تو در ایران؛ جریانی که همسو با اتفاق‌های جهانی، در ایران نیز به راه افتاده و از یک جایی به بعد که پای عناصر خارجی به آن باز شد، سمت‌وسویی سیاسی پیدا کرده است. این جریان خزنده در تلاش است تا با رخنه در جمعیت سینماگر کشور، آنها را به تحریک و بزرگ‌نمایی در برخی از بی‌اخلاقی‌های رخ داده در این حوزه وادارد. به همین دلیل این جنبش هم‌اکنون به پناهگاهی تبدیل شده که طی آن، فقط اسم افراد خاطی آورده می‌شود و از جزئیات بیشتر این حوزه، خودداری به عمل می‌آید.

شدت این قبیل اتفاق‌ها طی روزهای اخیر به اندازه‌ای بوده که برخی سینماگران از جمله برخی زنان سینماگری که بیانیه آزار جنسی علیه زنان را امضا کرده بودند، امضای خود را پس گرفته و نسبت به این رویه که بی‌هیچ سندی، تنها یک نام مشهور آورده می‌شود را مورد نقد قرار داده‌اند.

رسانه‌های خارج‌نشین حالا در موج‌سواری جدید، به موضوع آبادان ورود کرده و از عواطف سینماگران سوءاستفاده کرده و به گونه ای وانمود کرده‌اند که سینماگران کشور، در مقابل نظام قرار گرفته‌اند. یک جریان‌سازی الکن که بدون نشر گسترده و حداکثری در فضای مجازی، با روشن‌گری بسیاری از امضاکنندگان این نامه ناکام ماند تا این رسانه‌های معاند، دومین شکست خود در تحریک سینماگران به ایجاد فضای ناآرام را متحمل شوند.",جزئیات پس گرفتن امضای سینماگران از یک بیانیه سیاسی | تیر خارج‌نشینان در تحریک سینماگران به سنگ خورد
